{
  "acquisition": {
    "bytes": 625797192,
    "download_seconds": 15.1,
    "dump_date": "2026-09-01",
    "filename": "discogs_20260901_masters.xml.gz",
    "free_disk_before_bytes": 164663144448,
    "kind": "dump",
    "licence_url": "https://data.discogs.com/",
    "profile_seconds": 235.8,
    "sha256": "55905be0384d1bbc8c6ef630edd8fb68dd740c24b88798ff8f54bbd81331b751",
    "url": "https://data.discogs.com/?download=data%2F2026%2Fdiscogs_20260901_masters.xml.gz"
  },
  "code_commit": "6d50422c4784414dae0753a868ebcfabf5702563",
  "feature_version": "0.1.0",
  "generated_at_utc": "2026-09-23T01:14:55+00:00",
  "profile_version": "1.0",
  "records": {
    "completeness": {
      "artist_credit": 0.999927,
      "title": 0.999856,
      "year": 0.933045
    },
    "duplicate_key": {
      "keys": 2521701,
      "keys_with_duplicates": 49108,
      "largest_key_size": 414,
      "record_rate": 0.045091,
      "records_in_duplicate_keys": 116756
    },
    "genres_present": 1.0,
    "main_release_present": 1.0,
    "multi_artist_credit_share": 0.143366,
    "numeric_disambiguator_share": 0.114521,
    "qualifier_share": 0.00059,
    "self_titled_share": 0.030723,
    "total": 2589349,
    "various_artists_share": 0.063894,
    "year": {
      "by_decade": {
        "1900": 1256,
        "1910": 3819,
        "1920": 9492,
        "1930": 10044,
        "1940": 14427,
        "1950": 84037,
        "1960": 178623,
        "1970": 237184,
        "1980": 283515,
        "1990": 429591,
        "2000": 430439,
        "2010": 483264,
        "2020": 250271
      },
      "max_in_range": 2026,
      "min_in_range": 1900,
      "missing": 173369,
      "out_of_range": 18
    }
  },
  "side": "B",
  "source": "discogs"
}
